{
  "$schema": "https://ducle1218.github.io/Duc-Le-Portfolio/data/portfolio.schema.json",
  "schemaVersion": "1.0.0",
  "snapshotId": "fcfc6767d7c98bddf01ff0431d914344dffacbb07b073b378a03d5c6e929e7d6",
  "siteUrl": "https://ducle1218.github.io/Duc-Le-Portfolio/",
  "sourceReviewedOn": "2026-10-30",
  "verification": {
    "level": "published-source-consistency-only",
    "independentlyVerified": false,
    "ownerApprovedForApplications": false,
    "description": "Extracted from the existing public portfolio. Source links and quotations support traceability, not independent verification. Unknown ownership and unfinished work remain explicit."
  },
  "profile": {
    "name": "Duc Le",
    "headline": "Mechanical engineering student at Rutgers University",
    "facts": [
      {
        "id": "education-current",
        "text": "Mechanical engineering student at Rutgers University; no completed degree is asserted by this record.",
        "evidence": {
          "path": "index.html",
          "quote": "Mechanical engineering student at Rutgers."
        }
      },
      {
        "id": "career-interest",
        "text": "Seeking mechanical engineering internships and hands-on opportunities.",
        "evidence": {
          "path": "index.html",
          "quote": "Seeking mechanical engineering internships and hands-on opportunities."
        }
      }
    ]
  },
  "resume": {
    "schemaVersion": "1.0.0",
    "path": "src/assets/resume/Duc_Le_Resume.pdf",
    "sha256": "a1827a739087d4f40bfe0428eb67362d81a90eddbafbecbe282676cb4dd3c2fa",
    "bytes": 142336,
    "url": "https://ducle1218.github.io/Duc-Le-Portfolio/src/assets/resume/Duc_Le_Resume.pdf",
    "authority": "Current public PDF; preview and download use this file.",
    "contentUpdatedOn": null,
    "projectReconciliation": "Not certified against every project claim. Resolve differences using current evidence; do not merge older exports.",
    "template": "PDF is the published baseline, not an editable resume template. Generate future tailored copies separately."
  },
  "usage": {
    "requireClaimEvidence": true,
    "allowInventedQualifications": false,
    "preserveOwnership": true,
    "preserveCompletionState": true,
    "preserveMetricConditions": true,
    "unknownMeans": "unknown, not no",
    "submissionReviewRequired": true,
    "jobPostingIsEvidenceAboutCandidate": false,
    "privateApplicationAnswersIncluded": false
  },
  "projects": [
    {
      "id": "box-12",
      "title": "Quadruped Robot",
      "stage": "College",
      "category": "PERSONAL",
      "dateLabel": "Oct 2026 — Present",
      "location": "Collaborative Build",
      "summary": "A collaborative quadruped prototype developed through CAD revisions, printed parts, and assembly fit checks.",
      "completionState": "prototype-in-progress",
      "ownership": {
        "individual": [
          "Onshape modeling, assembly clearances, and print-efficient revisions.",
          "Recreated the initial body and head from Ethan’s SolidWorks dimensions."
        ],
        "team": [
          "Ethan provided the initial SolidWorks dimensions.",
          "The notebook records four legs attached and one leg actuated."
        ],
        "notClaimed": [
          "Sole authorship of the initial SolidWorks design.",
          "Walking, tracking, or complete physical folding validation.",
          "A rated payload or measured production cost savings."
        ]
      },
      "tools": [
        {
          "name": "Onshape",
          "usage": "Body and head recreation, mechanism packaging, and clearance revisions.",
          "owner": "individual",
          "evidenceIds": [
            "box-12-role"
          ]
        },
        {
          "name": "3D Printing",
          "usage": "Printed fit checks and a mirrored support reprint; printer operator is not identified.",
          "owner": "unclear",
          "evidenceIds": [
            "box-12-printing"
          ]
        }
      ],
      "claims": [
        {
          "id": "box-12-cad-revisions",
          "text": "Extended the chassis from 160 to 225 mm and shortened the upper leg link from 143 to 135 mm in CAD.",
          "owner": "individual",
          "state": "modeled",
          "evidenceIds": [
            "box-12-role",
            "box-12-body",
            "box-12-leg"
          ],
          "metrics": [
            {
              "value": 160,
              "unit": "mm",
              "meaning": "Initial body length",
              "conditions": "CAD dimension before revision."
            },
            {
              "value": 225,
              "unit": "mm",
              "meaning": "Revised body length",
              "conditions": "CAD dimension; not a performance result."
            },
            {
              "value": 143,
              "unit": "mm",
              "meaning": "Initial upper leg link length",
              "conditions": "CAD dimension before revision."
            },
            {
              "value": 135,
              "unit": "mm",
              "meaning": "Revised upper leg link length",
              "conditions": "CAD dimension; not a performance result."
            }
          ]
        },
        {
          "id": "box-12-assembly-progress",
          "text": "The collaborative build record documents four legs attached and one leg actuated.",
          "owner": "team",
          "state": "built",
          "evidenceIds": [
            "box-12-hardware"
          ],
          "metrics": [
            {
              "value": 4,
              "unit": "legs",
              "meaning": "Attached legs",
              "conditions": "Notebook record; does not establish walking."
            },
            {
              "value": 1,
              "unit": "leg",
              "meaning": "Actuated leg",
              "conditions": "Notebook record; full robot gait remains unverified."
            }
          ]
        },
        {
          "id": "box-12-folding-next",
          "text": "The CAD packages all four legs below the body; physical folding validation is next.",
          "owner": "unclear",
          "state": "planned",
          "evidenceIds": [
            "box-12-folding"
          ],
          "metrics": []
        }
      ],
      "evidence": [
        {
          "id": "box-12-role",
          "path": "src/content/projects/box-12.html",
          "quote": "My work focuses on Onshape modeling, assembly clearances, and print-efficient revisions. I recreated the initial body and head from teammate Ethan’s SolidWorks dimensions, then developed the changes shown here.",
          "url": "https://ducle1218.github.io/Duc-Le-Portfolio/src/content/projects/box-12.html",
          "sourceSha256": "0db869b142e714b3f768ee306f8bef9953b7162819d4e5a09e572779f4244561"
        },
        {
          "id": "box-12-body",
          "path": "src/content/projects/box-12.html",
          "quote": "Increased body length from 160 to 225 mm while simplifying the frame for continued prototyping.",
          "url": "https://ducle1218.github.io/Duc-Le-Portfolio/src/content/projects/box-12.html",
          "sourceSha256": "0db869b142e714b3f768ee306f8bef9953b7162819d4e5a09e572779f4244561"
        },
        {
          "id": "box-12-leg",
          "path": "src/content/projects/box-12.html",
          "quote": "Reduced the link from 143 to 135 mm so the legs fit without further lengthening the body.",
          "url": "https://ducle1218.github.io/Duc-Le-Portfolio/src/content/projects/box-12.html",
          "sourceSha256": "0db869b142e714b3f768ee306f8bef9953b7162819d4e5a09e572779f4244561"
        },
        {
          "id": "box-12-hardware",
          "path": "src/content/projects/box-12.html",
          "quote": "The notebook later records all four legs attached and one leg actuated.",
          "url": "https://ducle1218.github.io/Duc-Le-Portfolio/src/content/projects/box-12.html",
          "sourceSha256": "0db869b142e714b3f768ee306f8bef9953b7162819d4e5a09e572779f4244561"
        },
        {
          "id": "box-12-folding",
          "path": "src/content/projects/box-12.html",
          "quote": "Latest CAD configuration shows all four legs packaged below the body. Physical folding validation is next.",
          "url": "https://ducle1218.github.io/Duc-Le-Portfolio/src/content/projects/box-12.html",
          "sourceSha256": "0db869b142e714b3f768ee306f8bef9953b7162819d4e5a09e572779f4244561"
        },
        {
          "id": "box-12-printing",
          "path": "src/content/projects/box-12.html",
          "quote": "A right-hand support did not fit the left side. Mirroring and reprinting corrected the mismatch.",
          "url": "https://ducle1218.github.io/Duc-Le-Portfolio/src/content/projects/box-12.html",
          "sourceSha256": "0db869b142e714b3f768ee306f8bef9953b7162819d4e5a09e572779f4244561"
        }
      ],
      "limitations": [
        "Single-leg actuation does not establish a walking robot.",
        "All-leg folding is shown in CAD; physical folding validation remains next.",
        "Slicer estimates are estimates, and export dates are not design dates."
      ],
      "reviewNeeded": [
        "Confirm the division of assembly and actuation work between collaborators.",
        "Confirm progress after the October 2–11 notebook entries."
      ],
      "updatedOn": null,
      "url": "https://ducle1218.github.io/Duc-Le-Portfolio/?project=box-12"
    },
    {
      "id": "box-7",
      "title": "Volumetric Display",
      "stage": "College",
      "category": "PERSONAL",
      "dateLabel": "Aug 2026 — Present",
      "location": "Collaborative Build",
      "summary": "Mechanical CAD and preliminary structural studies for a swept-volume display.",
      "completionState": "cad-and-preliminary-analysis",
      "ownership": {
        "individual": [],
        "team": [
          "Listed as a collaborative build; task ownership is not separated in the detailed record."